{
  "partWeight" : 1000.0,
  "referenceNumber" : "774773he878",
  "materialList" : [ {
    "materialOrigin" : [ {
      "materialOriginCountry" : "USA",
      "valuePercentage" : 80.0,
      "originWeight" : 300.0
    } ],
    "materialValue" : {
      "amount" : 50.0,
      "currency" : "EUR"
    },
    "processing" : [ {
      "certificateResource" : "telnet://192.0.2.16:80/",
      "processingCountry" : "USA",
      "processingType" : "Smelting"
    } ],
    "materialClassification" : {
      "classificationStandard" : "VDA 231-106",
      "materialCategory" : "1",
      "materialGroup" : "1.1",
      "materialSubgroup" : "1.1.1"
    },
    "customsClassification" : {
      "customClassificationCode" : "1234.56.7890",
      "customClassificationCodingSystem" : "HS"
    }
  } ],
  "partValue" : {
    "amount" : 50.0,
    "currency" : "EUR"
  },
  "globalAssetId" : "eE393fA8-91f6-2c4d-86ad-530c567DDAe6",
  "customsClassification" : {
    "customClassificationCode" : "1234.56.7890",
    "customClassificationCodingSystem" : "HS"
  },
  "partOriginCountry" : "USA"
}